seed_key,seed_label,source_system,source_id,doi,pmid,pmcid,title,authors,journal,year,url,abstract,query,fetched_at
i131,I-131,EuropePMC,MED39080211,10.1007/s12020-024-03961-7,39080211,,Challenges in treating radioiodine-refractory thyroid cancer: a global perspective with a focus on developing nations in Latin America.,"Penna GC, Rajão KMAB, Santana DC, Santana DC, Costa PH, Carvalho PH, Gomes GA, Avelar GA, Chaves ALF, Pitoia F.",,2024,https://europepmc.org/article/MED/39080211,"<h4>Purpose</h4>This article aims to comprehensively analyze the unique challenges in managing patients with metastatic Differentiated Thyroid Cancer (DTC) that develop radioiodine-refractory disease, especially in developing countries in Latin America. We discuss key contentious aspects of their treatment, such as the optimal timing for initiating systemic therapy, the choice of first-line medications, the appropriate timing for requesting molecular interrogation, and the challenges associated with accessing these drugs and molecular panels.<h4>Methods</h4>To illustrate these challenges and enhance understanding, we present five real clinical cases from the authors' experiences.<h4>Results</h4>Patients with Differentiated Thyroid Cancer (DTC) generally have an excellent prognosis, with an overall 10-year survival rate exceeding 97%. However, approximately 5% of DTC patients, especially those with distant metastases, may develop radioiodine-refractory disease, reducing survival rates. Access to medications remains difficult and time-consuming, particularly for patients within the public healthcare system. Urgent discussions on drug pricing involving all stakeholders are imperative. To break free from complacency, stakeholders must prioritize patient well-being by advocating for evidence-based drug pricing, increased participation in clinical trials, and streamlined regulatory processes.<h4>Conclusion</h4>Beyond the recognized need for prospective randomized clinical trials to determine the optimal first-line drug and the timing of molecular testing, this type of manuscript plays a pivotal role in stimulating discussions and disseminating comprehensive knowledge about the challenges associated with treating and monitoring patients with radioiodine-refractory thyroid carcinoma, especially in developing countries.","(""I-131"" OR ""Iodine-131"" OR radioiodine) AND (CCHEN OR Chile OR ""Latin America"" OR radioprotection)",2026-05-19
i131,I-131,EuropePMC,MED37380825,10.1007/s11154-023-09818-0,37380825,,Management of radioiodine refractory differentiated thyroid cancer: the Latin American perspective.,"Pitoia F, Scheffel RS, Califano I, Gauna A, Tala H, Vaisman F, Gonzalez AR, Hoff AO, Maia AL.",,2024,https://europepmc.org/article/MED/37380825,"Radioiodine (RAI) refractory differentiated thyroid cancer is an uncommon and challenging situation that requires a multidisciplinary approach to therapeutic strategies. The definition of RAI-refractoriness is usually a clear situation in specialized centers. However, the right moment for initiation of multikinase inhibitors (MKI), the time and availability for genomic testing, and the possibility of prescribing MKI and selective kinase inhibitors differ worldwide.Latin America (LA) refers to the territories of the world that stretch across two regions: North America (including Central America and the Caribbean) and South America, containing 8.5% of the world's population. In this manuscript, we critically review the current standard approach recommended for patients with RAI refractory differentiated thyroid cancer, emphasizing the challenges faced in LA. To achieve this objective, the Latin American Thyroid Society (LATS) convened a panel of experts from Brazil, Argentina, Chile, and Colombia. Access to MKI compounds continues to be a challenge in all LA countries. This is true not only for MKI but also for the new selective tyrosine kinase inhibitor, which will also require genomic testing, that is not widely available. Thus, as precision medicine advances, significant disparities will be made more evident, and despite efforts to improve coverage and reimbursement, molecular-based precision medicine remains inaccessible to most of the LA population. Efforts should be undertaken to alleviate the discrepancies between the current state-of-the-art care for RAI-refractory differentiated thyroid cancer and the present situation in Latin America.","(""I-131"" OR ""Iodine-131"" OR radioiodine) AND (CCHEN OR Chile OR ""Latin America"" OR radioprotection)",2026-05-19
i131,I-131,EuropePMC,MED41296580,10.25259/ijmr_542_2025,41296580,PMC12744558,Radioprotectors &amp; mitigators in radiation therapy: Harnessing diverse pathways for optimizing clinical outcomes.,"Palkar PA, John G, Chekuri G, Chatterjee A, Kunwar A, Goda JS.",,2025,https://europepmc.org/article/MED/41296580,"Radioprotectors are agents that protect normal tissues from the harmful effects of radiation during cancer treatment. Combining these protective agents with advanced radiotherapy techniques such as stereotactic body radiotherapy (SBRT) and proton therapy offers a promising strategy to enhance therapeutic efficacy while minimizing normal tissue toxicity. However, despite extensive research and the identification of numerous potential radioprotectors, only a few have made it into clinical practice. It is primarily because the transition from laboratory research to clinical application faces significant challenges. These include adverse side effects, lack of tissue specificity, complex regulatory requirements, and the high cost of development and implementation. Addressing these challenges requires a multifaceted approach. Streamlined regulatory pathways and increased funding for translational research can further accelerate the clinical adoption of these agents. This paper reviews the landscape of radioprotector research, examining the biological mechanisms, clinical trials, and challenges that have limited the clinical translation of many promising agents. This review underscores the critical need for continued research and innovation to bridge the gap between experimental radioprotectors and viable clinical treatments, aiming to enhance the therapeutic ratio of radiotherapy in oncology.","(""I-131"" OR ""Iodine-131"" OR radioiodine) AND (CCHEN OR Chile OR ""Latin America"" OR radioprotection)",2026-05-19
i131,I-131,EuropePMC,MED41063907,10.7759/cureus.91784,41063907,PMC12503003,Papillary Thyroid Carcinoma and Its Hormonal Effects in Women Following Surgical Removal.,"Salazar S, Yang EG, Reddy VN, Veluri SC.",,2025,https://europepmc.org/article/MED/41063907,"While typically viewed as indolent, papillary thyroid carcinoma (PTC) is a clinically significant health condition, especially among women, as the primary treatment for PTC, thyroidectomy, and disproportionately affects them. Thyroidectomy disrupts endocrine function, often necessitating a lifetime of hormone replacement therapy, yet postoperative hormonal outcomes remain understudied. PTC's global research trends, post-treatment effects, and treatment methods are the primary focus of this bibliometric analysis, as the growing awareness of PTC and medical drug toxicity continues to stimulate medical research. Bibliometric methods were used to evaluate trends in PTC-related publications from 2016 to 2025, acquiring data from the Web of Science database. The database searched for the following keywords: ""papillary thyroid carcinoma"", ""thyroidectomy"", ""hormone replacement therapy"", and ""women's health."" Data were downloaded and analyzed using VOSviewer (Leiden University, Leiden, The Netherlands), a bibliometric network creation and visualization software. The qualitative analysis included analysis of co-occurrence of specific keywords in and between publications, common co-authorships, analysis of national collaboration networks, and thematic mapping. Results indicated that the literature primarily focuses on PTC and surgical treatments while neglecting endocrine outcomes, hormonal challenges, and postoperative quality of life. The keywords ""surgery"" and ""management"" are widespread, whereas ""levothyroxine"" and ""replacement therapy"" are rarely used. Despite the thyroid gland's central position in endocrine control, few studies connect treatment of PTC with any systemic hormonal effects. Moreover, international collaboration is highest between France, the People's Republic of China, and the United States, with the same nations also topping PTC publication figures. A growing interest is shown by the increasing number of publications. Throughout, the bibliometric analysis","(""I-131"" OR ""Iodine-131"" OR radioiodine) AND (CCHEN OR Chile OR ""Latin America"" OR radioprotection)",2026-05-19
i131,I-131,EuropePMC,MED39118310,10.1177/00368504241253715,39118310,PMC11318648,Assessment of psychological status by a comprehensive approach in thyroid cancer patients undergoing radionuclide therapy: A feasibility study.,"Giordano A, Bochicchio I, Gallicchio R, Deiana G, Storto R, Nardelli A, Di Cosola M, Lettini A, Storto G.",,2024,https://europepmc.org/article/MED/39118310,"This feasibility study evaluated the psychological status of patients with differentiated thyroid cancer (DTC) before, during, and 40 days after administration of I-131 radionuclide therapy (RAI). We investigated the appropriateness of providing patient a comprehensive psychological assessment in an isolation ward. Thirty consecutive patients (Study Group; SG) who received RAI were enrolled. The tools used were the Hospital Anxiety and Depression Scale (HADS) at three different moments, and the Coping Responses Inventory (CRI) at baseline for each patient. A supportive approach was also implemented. Data were collected at the first specialist visit, at the day of admission, and at 40 days follow-up visit. A matched cohort of patients (Control Group; CG), who did not receive psycho-oncological counseling, was retrospectively studied only about their medical needs and requests. Staff exposure to radiation was also compared during SG and CG hospitalization, to assess a possible reduction of radiological risk for them. A significant difference between the basal, intermediate, and final psychological status was observed (p < 0.0001), which was found to be irrespective of the induced hypothyroidism. Patients showed a significant worsening of their status in terms of anxiety and depression after the consent, but it improved 40 days after treatment. Repeated measures analysis showed a similar trend in patients' psychological status over this period. At hospital discharge, patients showed indirect signs of increased well-being. CG required more nursing and medical interventions. Staff exposure was significantly lower during hospitalization of SG as compared to CG. This study demonstrates that timed psychological evaluation and appropriate support may help to reduce anxiety and depression of patients receiving a diagnosis of cancer and undergoing RAI. Moreover, an improvement of workplace safety was recorded.","(""I-131"" OR ""Iodine-131"" OR radioiodine) AND (CCHEN OR Chile OR ""Latin America"" OR radioprotection)",2026-05-19
i131,I-131,EuropePMC,MED41746558,10.1186/s41181-025-00395-y,41746558,PMC13038832,Drug interactions involving therapeutic radiopharmaceuticals: a systematic review.,"Gacon R, Chapuis R, Fabris-Davet L, Ranjit N, Goutelle S, Bourguignon L, Flaus A, Bolot C, Levigoureux E, Gallet M, Chaib S.",,2026,https://europepmc.org/article/MED/41746558,"<h4>Background</h4>Drug interactions with diagnostic radiopharmaceuticals are well recognized, as they can modify biodistribution and lead to false or misleading diagnostic results. However, little is known about such interactions in the field of therapeutic radiopharmaceuticals, despite their rapid expansion-particularly with targeted radionuclide therapies such as Radioligand Therapy (RLT). This review aims, for the first time, to systematically compile and analyze available data on drug interactions involving therapeutic radiopharmaceuticals, in order to support safer and more effective patient care.<h4>Main body</h4>Eighty-three articles investigating drug interactions with [<sup>177</sup>Lu]Lu-oxodotreotide (Lutathera®), [<sup>177</sup>Lu]Lu-vipivotide tetraxetan (Pluvicto®), [<sup>131</sup>I]INa, [<sup>131</sup>I]I-meta-iodobenzylguanidine ([<sup>131</sup>I]I-MIBG), [<sup>223</sup>Ra]RaCl<sub>2</sub> (Xofigo®), [<sup>90</sup>Y]Y-ibritumomab tiuxetan (Zevalin®) or [<sup>153</sup>Sm]Sm-lexidronam pentasodium (Quadramet®) were included. These studies reported 133 drug interactions, 69% of which were not mentioned in the corresponding summaries of product characteristics. Interactions could be beneficial (e.g., reducing renal toxicity) or harmful (e.g., decreasing therapeutic efficacy or potentiating toxicity). Three interactions involved complementary and alternative medicines (quercetin, Ginkgo biloba and ouabain). Overall, the evidence level for reported interactions was low: 88% were classified as level 3 or 4 according to the Centre for Evidence-Based Medicine (CEBM) scale.<h4>Conclusion</h4>Drug interactions with therapeutic radiopharmaceuticals remain underreported, yet they may have significant clinical consequences. Clinical radiopharmacy plays a key role in detecting and preventing these interactions. Radiopharmacists, through their expertise, can identify potential interactions, influence therapeutic decisions, and positively impact patient management. ","(""I-131"" OR ""Iodine-131"" OR radioiodine) AND (CCHEN OR Chile OR ""Latin America"" OR radioprotection)",2026-05-19
i131,I-131,EuropePMC,MED39699644,10.1089/thy.2024.0338,39699644,,Radiofrequency Ablation for Solitary Autonomously Functioning Thyroid Nodules: Multicenter Study from Latin America.,"Dueñas JP, Buitrago-Gómez N, Rahal A, Steck JH, García C, De Cicco R, Rangel LG, Voogd A, Savluk L, Volpi EM.",,2025,https://europepmc.org/article/MED/39699644,"<b><i>Background:</i></b> Autonomously functioning thyroid nodules (AFTNs) represent ∼5% of all thyroid nodules and often necessitate definitive treatments such as surgery or radioiodine (<sup>131</sup>I), both of which have inherent risks. Radiofrequency ablation (RFA) has emerged as an effective and safe therapeutic option for managing AFTNs. This study aims to assess the effectiveness and safety of RFA for solitary AFTNs in various countries across Latin America. <b><i>Methods:</i></b> This retrospective, observational, multicenter cohort study included patients with a solitary AFTN that was histologically confirmed as benign and treated with a single session of RFA. The study included an analysis of patient demographics, sonographic characteristics of the nodules, thyroid profile assessment at each follow-up visit, evaluation of clinical symptoms to determine the achievement of a euthyroid state, and the measurement of nodule volume reduction. In addition, a bivariate analysis was conducted to identify associations between these variables and the resolution of hyperthyroidism. <b><i>Results:</i></b> Our study enrolled 81 patients with a solitary, benign AFTN. The volume reduction ratio (VRR) consistently increased over the follow-up period, with medians of -50%, -74.9%, -78.4%, and -90.2% at 1, 3, 6, and 12 months, respectively. The rate of resolution of hyperthyroidism was 93.8% (76/81). Following the RFA procedure, 58.02% of patients (47/81) normalized their thyrotropin levels within 1 month of follow-up, and by 3 months, an additional 33.3% had achieved normalization (27/81). Notably, a baseline volume ≥10, 20, or 30 mL did not affect the achievement of clinical success. In bivariate analyses, a VRR ≥50% at the 6-month follow-up was associated with the resolution of hyperthyroidism. Overall complications occurred in 6.2% of patients (5/81), including 1.2% (1/81) of a major complication (transient Horner syndrome), 3.7% cases of transient dysphonia (3/81), and","(""I-131"" OR ""Iodine-131"" OR radioiodine) AND (CCHEN OR Chile OR ""Latin America"" OR radioprotection)",2026-05-19
i131,I-131,EuropePMC,MED36765697,10.3390/cancers15030740,36765697,PMC9913142,Probiotic Bacteria Cannot Mitigate the Adverse Effects of Radioactive Iodine-131 Treatment.,"Mortazavi SMJ, Nowroozi S, Haghani M, Zarrini-Monfared Z, Gheisari F, Sihver L.",,2023,https://europepmc.org/article/MED/36765697,"Thyroid carcinoma is the most common cancer of the endocrine system, accounting for 12% of all cancer cases in adolescents in the United States. Radioiodine therapy plays a key role in differentiated thyroid cancer (DTC) treatment. This double-blind, randomized, placebo-controlled clinical trial was aimed at evaluating the effect of probiotics supplementation in reducing the acute side-effects of radioiodine therapy in PTC patients. Fifty-six patients were randomly divided into four groups: one placebo and three intervention groups. The probiotics product used in this study was LactoCare (ZistTakhmir Co., Tehran, Iran), a multi-strain commercially available symbiotic containing 12 strains of probiotic species including Lactobacillus strains, Bifidobacteria strains, and Streptococcus thermophilus, plus Fructo-oligosaccharides as the prebiotic. Group 0 was our placebo group (no probiotics), while the other three groups received probiotics capsules for 2/4 days, starting only 2 days prior to radioiodine therapy, only 4 days after radioiodine therapy or 2 days prior and 4 days after radioiodine therapy. Six patients were withdrawn during the study because of poor compliance or at their own request. The symptoms reported by patients including data about the incidence and duration of each complication were recorded. The probiotics' effectiveness was confirmed for dry mouth and taste loss or change when it was administered prior to the radioiodine treatment. The benefit was not confirmed for other radiation-induced complications such as pain and swelling in the neck, nausea and vomiting, salivary gland swelling, and diarrhea. Further large-scale clinical trials are warranted to improve our knowledge in this quickly evolving field.","(""I-131"" OR ""Iodine-131"" OR radioiodine) AND (CCHEN OR Chile OR ""Latin America"" OR radioprotection)",2026-05-19
i131,I-131,EuropePMC,MED37300484,10.1089/thy.2023.0090,37300484,,Dysfunction of the Salivary and Lacrimal Glands After Radioiodine Therapy for Thyroid Cancer: Results of the START Study After 6-Months of Follow-Up.,"Baudin C, Bressand A, Buffet C, Menegaux F, Soret M, Lê AT, Cardon T, Broggio D, Bassinet C, Huet C, Armengol G, Richardson DB, Leenhardt L, Bernier MO, Lussey-Lepoutre C.",,2023,https://europepmc.org/article/MED/37300484,"<b><i>Background:</i></b> Understanding of changes in salivary and lacrimal gland functions after radioactive iodine therapy (<sup>131</sup>I-therapy) remains limited, and, to date, no studies have evaluated dose-response relationships between absorbed dose from <sup>131</sup>I-therapy and dysfunctions of these glands. This study investigates salivary/lacrimal dysfunctions in differentiated thyroid cancer (DTC) patients six months after <sup>131</sup>I-therapy, identifies <sup>131</sup>I-therapy-related risk factors for salivary/lacrimal dysfunctions, and assesses the relationships between <sup>131</sup>I-therapy radiation dose and these dysfunctions. <b><i>Methods:</i></b> A cohort study was conducted involving 136 DTC patients treated by <sup>131</sup>I-therapy of whom 44 and 92 patients received 1.1 and 3.7 GBq, respectively. Absorbed dose to the salivary glands was estimated using a dosimetric reconstruction method based on thermoluminescent dosimeter measurements. Salivary and lacrimal functions were assessed at baseline (T0, i.e., immediately before <sup>131</sup>I-therapy) and six months later (T6) using validated questionnaires and salivary samplings, with and without stimulation of the salivary glands. Statistical analyses included descriptive analyses and random-effects multivariate logistic and linear regressions. <b><i>Results:</i></b> There was no difference between T0 and T6 in the level of parotid gland pain, nor was there difference in the number of patients with hyposalivation, but there were significantly more patients with dry mouth sensation and dry eyes after therapy compared with baseline. Age, menopause, depression and anxiety symptoms, history of systemic disease, and not taking painkillers in the past three months were found to be significantly associated with salivary or lacrimal disorders. Significant associations were found between <sup>131</sup>I-exposure and salivary disorders adjusted on the previous variables: for example, per 1-Gy in","(""I-131"" OR ""Iodine-131"" OR radioiodine) AND (CCHEN OR Chile OR ""Latin America"" OR radioprotection)",2026-05-19
i131,I-131,EuropePMC,MED38907832,10.1007/s11136-024-03721-0,38907832,,Health-related quality of life and radioiodine therapy in thyroid cancer patients: a before-and-after study.,"Legrand A, Bernier MO, Bressand A, Buffet C, Mandin C, Menegaux F, Soret M, Broggio D, Bassinet C, Huet C, Leenhardt L, Lussey-Lepoutre C, Baudin C.",,2024,https://europepmc.org/article/MED/38907832,"<h4>Objective</h4>Thyroid cancers are on the rise, but the associated vital prognosis and long-term survival rates are very good. Therefore, treated patients' quality of life and psychological well-being are important considerations. The treatment usually involves surgery and radioactive iodine (radioiodine) ablation. This study aims to investigate potential effects of radioiodine ablation therapy on health-related quality of life, anxiety and depression symptoms, and nutritional status at 6 months post-therapy.<h4>Methods</h4>This study included 136 patients diagnosed with thyroid cancer. Absorbed doses to the salivary glands were estimated from dosimeters worn by patients. Patient health-related quality of life, psychological status and nutritional status were assessed before and 6 months after therapy using standardized questionnaires (including SF-36, Hospital Anxiety and Depression (HAD) scale). Statistical analyses included random-effects logistic and linear regressions adjusted for potential confounders.<h4>Results</h4>While no significant association was found between radioiodine exposure and anxiety or depression symptoms, or nutritional status, a significant increase in the SF-36 role physical sub- score was observed in relation with the salivary gland dose (β= 6.54, 95%CI 2.71;10.36 for a 1-Gy increase).<h4>Conclusions</h4>The findings suggest an improved physical health-related quality of life, namely reduced pain and functional impairment, 6 months after radioiodine therapy in thyroid cancer patients. No significant association was found between radioiodine exposure and mental health-related quality of life, anxiety or depression scores nor nutritional status. This study does not provide any evidence that radioiodine therapy has a potentially adverse effect on patient health-related quality of life.","(""I-131"" OR ""Iodine-131"" OR radioiodine) AND (CCHEN OR Chile OR ""Latin America"" OR radioprotection)",2026-05-19
i131,I-131,EuropePMC,MED38886971,10.11005/jbm.2024.31.2.140,38886971,PMC11184150,Impaired Quality of Life in Patients with Post-Surgical Hypoparathyroidism.,"Ivanovic-Zuvic D, Chelebifski S, Uribe B, Quintana C, Domínguez JM, Olmos R, Florenzano P.",,2024,https://europepmc.org/article/MED/38886971,"<h4>Background</h4>Hypoparathyroidism is characterized by chronic hypocalcemia with low or abnormal parathyroid hormone levels. Thyroid surgery remains a predominant cause of hypoparathyroidism, often preventable by partial thyroidectomy. Although hypoparathyroidism can impair quality of life (QOL), data remain limited for Latin America. We aimed to characterize clinical manifestations and QOL in patients with postsurgical hypoparathyroidism.<h4>Methods</h4>This case-control study included patients (&gt;18 years) who underwent total thyroidectomy (TT) for differentiated thyroid cancer (DTC) with postsurgical hypoparathyroidism (Group 1, Cases) and those with DTC who underwent TT without postsurgical hypoparathyroidism (Group 2, Controls). Clinical records were collected, and the SF-36v2 QOL survey and a structured symptom survey were applied. A logistic multivariate regression analysis was performed.<h4>Results</h4>This study included 106 subjects (Group 1, N=41; Group 2, N=65). Group 1 patients were younger, had a higher frequency of lymph node resection, and more frequently received Ι-131 than Group 2 patients (p&lt;0.05). In the SF-36v2 survey, Group 1 had fewer physical-functioning scores (odds ratio, 3.8; 95% confidence interval, 1.2-11.7) and lower scores in mental and physical components than Group 2 and national records. Commonly reported symptoms include paresthesia, daily fatigue, and memory alterations. Treatment adherence rates were 56% and 71% for calcium and calcitriol, respectively. Furthermore, 24% of patients experienced one or more hypoparathyroidism drug-related adverse effects.<h4>Conclusions</h4>Patients with postsurgical hypoparathyroidism had an impaired QOL, a high frequency of disease-associated symptoms, and limited treatment adherence. These results should be considered when deciding the best surgical alternative for DTC.","(""I-131"" OR ""Iodine-131"" OR radioiodine) AND (CCHEN OR Chile OR ""Latin America"" OR radioprotection)",2026-05-19
