seed_key,seed_label,source_system,source_id,doi,pmid,pmcid,title,authors,journal,year,url,abstract,query,fetched_at
ga68_dotatate,Ga-68 DOTATATE,EuropePMC,MED19623420,/s0034-98872009000400012,19623420,,[Detection of neuroendocrine tumors by positron emission tomography-computed tomography with 68Ga-DOTATATE: report of one case].,"Amaral H, Pruzzo R, Redondo F, Gil MC, Pizarro A, de la Fuente H, Butte JM, Coudeu TM.",,2009,https://europepmc.org/article/MED/19623420,"We report a 74-year-old male with liver metastases from a neuroendocrine tumor (NET) of unknown origin. Conventional imaging studies with ultrasound, computed tomography colonoscopy and Positron emission tomography-computed tomography (PET/CT) with 18Fluor odeoxyglucose did not identify the site of origin of the primary tumor. The patient was submitted for a PET/CT scan with a new radiopharmaceuticai, the somatostatin analogue 68Ga-DOTATATE. This new technique demonstrated increased focal uptake at the ileocecal valve. This lesion and other two liver metastases were surgically removed. The histopathology and immunohistochemistry analysis confirmed the diagnosis of NET (carcinoid). This case illustrates the advantages of the PET/CT scan with 68Ga-DOTATATE.","(""Ga-68 DOTATATE"" OR ""Gallium-68 DOTATATE"" OR ""68Ga-DOTATATE"") AND (CCHEN OR Chile OR ""Latin America"")",2026-05-19
ga68_dotatate,Ga-68 DOTATATE,EuropePMC,PMCPMC11152847,,,PMC11152847,Insights into calcific aortic valve stenosis: a comprehensive overview of the disease and advancing treatment strategies,"Jain H, Goyal A, Khan A, Khan N, Jain J, Chopra S, Sulaiman S, Reddy M, Patel K, Khullar K, Daoud M, Sohail A.",,2024,https://europepmc.org/article/PMC/PMC11152847,,"(""Ga-68 DOTATATE"" OR ""Gallium-68 DOTATATE"" OR ""68Ga-DOTATATE"") AND (CCHEN OR Chile OR ""Latin America"")",2026-05-19
ga68_dotatate,Ga-68 DOTATATE,EuropePMC,PMCPMC7207902,,,PMC7207902,SUN-116 The Role of 68Gallium DOTATATE PET/CT Versus 18F-FDOPA PET/CT in the Imaging of Neuroendocrine Neoplasms in Patients with Multiple Endocrine Neoplasia Type 1 (MEN1),"Tepede A, Lee M, Welch J, Mandl A, Bansal R, Cochran C, Agarwal S, Simonds W, Weinstein L, Millo C, Sadowski S, Blau J.",,2020,https://europepmc.org/article/PMC/PMC7207902,"Abstract Background: Neuroendocrine neoplasms (NEN) are a heterogenous group of tumors. Patients with the multiple endocrine neoplasia type 1 (MEN1) syndrome often manifest with simultaneous functional and non-functional NEN in various endocrine glands. In MEN1, nuclear medicine plays an important role in the diagnostic work-up and localization of NEN. Little is known about the comparative efficacy of 68Ga-Dotatate PET/CT (DOTA) versus 18F-FDOPA PET/CT (FDOPA) and both versus non-nuclear medicine imaging (CT and MRI) in the identification of primary and metastatic NEN. Methods: This prospective MEN1 cohort study evaluated 15 germline MEN1 mutation-positive patients. Subjects were imaged using CT, MRI, DOTA and 18F-FDOPA. Radiological review with a multidisciplinary team was performed for each patient. Results: One-hundred twenty-nine total lesions were identified using any of the four scans. DOTA sensitivity was 69% (89/129; 95% CI 61% to 76%) with a mean standardized uptake value (SUV) of 33.9 ± 30.1, FDOPA sensitivity was 18% (23/129; 95% CI 12% to 25%) with mean SUV of 12.1 ± 15.16. DOTA identified an additional 50 lesions not seen on CT (of which MRI detected 8 lesions with an average size 0.95 cm ± 0.48; 3 pancreatic, 2 duodenal, 2 liver, and 1 lymph node) and identified 55 lesions not seen on MRI (of which CT identified 13 with a mean size of 1.1 cm ± 0.45; 1 lung, 4 pancreatic, 2 duodenal, 1 liver, and 5 lymph nodes). Overall, CT detected 51.2% (66/129) of lesions (mean 0.61 cm ± 0.73; 95% CI 43% to 60%) and MRI detected 39.5% (51/129; 0.47 cm ± 0.71; 95% CI 32% to 48%), and there was no significant difference in the size of lesions detected (p=0.18). Analysis by organ NEN revealed equal sensitivity between FDOPA and DOTA for lung carcinoid, detecting 33% (4/12) of lesions, while CT detected 92% (11/12) of lesions. In the duodenum, DOTA identified 100% (11 /11) of lesions, while FDOPA had poor sensitivity (9%) in this location. Within the pancreas, DOTA has a","(""Ga-68 DOTATATE"" OR ""Gallium-68 DOTATATE"" OR ""68Ga-DOTATATE"") AND (CCHEN OR Chile OR ""Latin America"")",2026-05-19
ga68_dotatate,Ga-68 DOTATATE,EuropePMC,PMCPMC8636152,,,PMC8636152,Abstracts From the Argentinian Society of Osteology and Mineral Metabolism (AAOMM) and Argentinian Society of Osteoporosis (SAO) 2020 Annual Meeting,,,2021,https://europepmc.org/article/PMC/PMC8636152,,"(""Ga-68 DOTATATE"" OR ""Gallium-68 DOTATATE"" OR ""68Ga-DOTATATE"") AND (CCHEN OR Chile OR ""Latin America"")",2026-05-19
ga68_dotatate,Ga-68 DOTATATE,EuropePMC,PMCPMC8089491,,,PMC8089491,Brain Metastases in a Patient With Papillary Thyroid Carcinoma. Clinical Case Report,"Ramos A, Zambrano Urbano J, Pico V, García F, Arboleda M, Valencia C, Chaparro J.",,2021,https://europepmc.org/article/PMC/PMC8089491,"Abstract Introduction: Papillary thyroid carcinoma (PTC) is the most common neoplasm of the endocrine system and the least aggressive, representing between 70% and 80% of thyroid neoplasms. This is characterized by slow growth and a low risk of progression to metastasis. Brain Metastases (BM) associated with PTC occur with a incidence rate of 0.15%. Tyrosine kinase inhibitors (TKI) are a very promising alternative for managing these patients. Here is described the case of a patient with PTC with brain and lung metastases, her respective management and evolution. Clinical Case Report: A 64-year-old patient with a history of controlled hypothyroidism, who was recently diagnosed with high cell variant PTC, positive for BRAF V600E mutation. Neck CT revealed a thyroid mass extending to the superior mediastinum, with associated lung metastases. We started by suppressing TSH with levothyroxine. Brain MRI was done due to persistent and as safety precaution before starting thyrotropin alfa This showed multiple intra-parenchymal lesions compatible with BM. Patient received management with gamma Knife radiosurgery for BM and with lenvatinib 24mg day. The patient presented a decrease in tumor size by more than 50% in the neck, with disappearance of the majority of BM at 90 days. After 18 months of treatment, she was still alive. Discussion and Conclusion: PTC associated with BM has a very poor life expectancy, and there are not guidelines for its management and the treatment is based on case reports and expert opinions. Radiosurgery plus ITK combined therapy could provide better outcomes to these patients","(""Ga-68 DOTATATE"" OR ""Gallium-68 DOTATATE"" OR ""68Ga-DOTATATE"") AND (CCHEN OR Chile OR ""Latin America"")",2026-05-19
ga68_dotatate,Ga-68 DOTATATE,EuropePMC,PMCPMC8089971,,,PMC8089971,Calcitonin Non-Secreting Mixed Medullary-Papillary Thyroid Carcinoma: Report of a Rare Entity and Therapeutic Implications,"Oleinikov K, Grozinsky-Glasberg S, Atlan K, Maimon O, Popovtzer A, Weinberger J, Hirshoren N.",,2021,https://europepmc.org/article/PMC/PMC8089971,"Abstract Background: Medullary thyroid carcinoma (MTC) is a relatively rare and aggressive form of thyroid malignancy arising from parafollicular cells. The biochemical hallmark of MTC is elevated serum calcitonin (CTN), which aids initial diagnosis and disease surveillance. An atypical form of calcitonin non-secreting MTC has been previously described, with just over 50 cases published in the literature. This case report of a true mixed medullary-papillary thyroid carcinoma with a non-secretory medullary component is exceptionally rare. Clinical Case: A 67-year-old male presented with new-onset hoarseness and was found to have a 4 cm thyroid nodule replacing the right lobe with associated ipsilateral cord paralysis and ipsilateral cervical lymphadenopathy. The patient had no family history of endocrinopathies. A diagnosis of MTC was rendered at core-needle biopsy, based on the characteristic morphological findings and positive immunohistochemistry (IHC) for calcitonin (CTN) and CEA. Cervico-thoracic CT demonstrated tracheal and esophageal involvement by the tumor. The serum CEA was 8.7 pg/ml [0-5]; however, serum CTN was undetectable < 2 pg/ml [2-8.2]. The patient subsequently underwent a total thyroidectomy with bilateral central neck dissection and right lateral neck dissection. Excision of the tumor necessitated the dissection of involved esophageal muscle from mucosa and removal of four tracheal rings with part of the cricoid. The surgical specimen demonstrated a single 3.6 cm tumor in the right thyroid lobe composed of medullary and papillary intermixed neoplastic cells (mixed MTC-PTC) with predominant medullary component and gross extrathyroidal extension. Positive IHC for calcitonin, CEA, and thyroglobulin confirmed the diagnosis. Out of ninety resected lymph nodes in total, five nodes were involved with medullary carcinoma (with extranodal extension), and three had papillary carcinoma micrometastases. Postoperatively, the patient underwent adjuvant external","(""Ga-68 DOTATATE"" OR ""Gallium-68 DOTATATE"" OR ""68Ga-DOTATATE"") AND (CCHEN OR Chile OR ""Latin America"")",2026-05-19
ga68_dotatate,Ga-68 DOTATATE,EuropePMC,MED40725693,10.3390/jcm14145002,40725693,PMC12295279,Cardiac Imaging in the Diagnosis and Management of Heart Failure.,"Chaudhari M, Ashwath ML.",,2025,https://europepmc.org/article/MED/40725693,"Heart failure (HF) is a complex clinical syndrome that results from any structural or functional impairment of ventricular filling or ejection of blood. The etiology of heart failure is multifactorial, encompassing ischemic heart disease, hypertension, valvular disorders, cardiomyopathies, and metabolic and infiltrative diseases. Despite advances in pharmacologic and device-based therapies, heart failure continues to carry a substantial burden of morbidity, mortality, and healthcare utilization. With the advancement and increased accessibility of cardiac imaging modalities, the diagnostic accuracy for identifying the underlying etiologies of nonischemic cardiomyopathy has significantly improved, allowing for more precise classification and tailored management strategies. This review aims to provide a comprehensive analysis of the current understanding of heart failure, encompassing epidemiology, etiological factors, with a specific focus on diagnostic imaging modalities including the role of echocardiography and strain imaging, cardiac magnetic resonance imaging (CMR), cardiac computed tomography (CT), and nuclear positron emission tomography (PET) imaging and recent advances in the diagnosis and management of heart failure.","(""Ga-68 DOTATATE"" OR ""Gallium-68 DOTATATE"" OR ""68Ga-DOTATATE"") AND (CCHEN OR Chile OR ""Latin America"")",2026-05-19
ga68_dotatate,Ga-68 DOTATATE,PubMed,19623420,,19623420,,[Detection of neuroendocrine tumors by positron emission tomography-computed tomography with 68Ga-DOTATATE: report of one case].,Amaral Horacio; Pruzzo Rossana; Redondo Francisca; Gil M Cecilia; Pizarro Alejandra; de la Fuente Hernán; Butte Jean M; Coudeu T M Irene,Revista medica de Chile,2009,https://pubmed.ncbi.nlm.nih.gov/19623420/,"We report a 74-year-old male with liver metastases from a neuroendocrine tumor (NET) of unknown origin. Conventional imaging studies with ultrasound, computed tomography colonoscopy and Positron emission tomography-computed tomography (PET/CT) with 18Fluor odeoxyglucose did not identify the site of origin of the primary tumor. The patient was submitted for a PET/CT scan with a new radiopharmaceuticai, the somatostatin analogue 68Ga-DOTATATE. This new technique demonstrated increased focal uptake at the ileocecal valve. This lesion and other two liver metastases were surgically removed. The histopathology and immunohistochemistry analysis confirmed the diagnosis of NET (carcinoid). This case illustrates the advantages of the PET/CT scan with 68Ga-DOTATATE.","(""Ga-68 DOTATATE"" OR ""Gallium-68 DOTATATE"" OR ""68Ga-DOTATATE"") AND (CCHEN OR Chile OR ""Latin America"")",2026-05-19
lu177_dotatate,Lu-177 DOTATATE,EuropePMC,MED41114110,10.4251/wjgo.v17.i10.110203,41114110,PMC12531762,Rectal neuroendocrine tumors in a Latin American population: Insights from a Peruvian national cancer institute.,"Cruz-Diaz WE, Leonardo A, Saavedra A, Paitan V, Haro-Varas J, Mantilla R, Macetas J, Veramendi E, Pacheco C, Calderón M, Vidaurre T, Castro-Oliden V.",,2025,https://europepmc.org/article/MED/41114110,"<h4>Background</h4>Well-differentiated rectal neuroendocrine tumors (rNETs) represent approximately 28% of gastrointestinal neuroendocrine tumors, with a rising incidence over recent decades. However, data from Perú remains limited.<h4>Aim</h4>To assess overall survival (OS) in patients with rNETs and describe the clinical and pathological characteristics of the study population.<h4>Methods</h4>This retrospective study included patients diagnosed with rNETs at the Instituto Nacional de Enfermedades Neoplásicas between 2009 and 2024. Qualitative variables were evaluated using the <i>χ</i> <sup>2</sup> test through contingency tables. OS was estimated using the Kaplan-Meier method, and differences between groups were assessed with the log-rank test. Cox proportional hazards models were used to evaluate variables associated with OS. All statistical analyses were conducted using R software.<h4>Results</h4>A total of 52 patients were included, with a mean age of 51.9 years (range: 27-74 years) and composed of 65.4% females. The most common stage at diagnosis was stage I (48.1%), followed by stage IV (36.5%). The median OS within the study population was 76 months. The 5-year OS for grade 1 tumors was 92.9% compared to 32.6% for grade 2 tumors (<i>P</i> = 0.00032). The median OS was 48 months for tumors exceeding 20 mm in size, whereas it was not reached for tumors measuring 20 mm or less (<i>P</i> = 0.0056). Similarly, the median OS for patients classified as lymph node involvement 1 was 46 months, while it was estimated at 112 months for those classified as lymph node involvement 0 (<i>P</i> = 0.0063).<h4>Conclusion</h4>rNETs exceeding 2 cm in size, classified as grade 2, or presenting with lymph node involvement 1 status were correlated with advanced disease stages and diminished survival outcomes.","(""Lu-177 DOTATATE"" OR ""Lutetium-177 DOTATATE"" OR ""177Lu-DOTATATE"") AND (CCHEN OR Chile OR ""Latin America"")",2026-05-19
lu177_dotatate,Lu-177 DOTATATE,EuropePMC,MED39539797,10.1530/eo-24-0021,39539797,PMC11558954,Less frequent radiological exams to avoid futile response assessments from 177-LuDOTATE therapy for patients with advanced neuroendocrine tumors.,"Marques CC, Brito AB, Lima EN, Donadio MD, Riechelmann RP.",,2024,https://europepmc.org/article/MED/39539797,"<h4>Background</h4>177-LuDOTATE is an effective but expensive treatment for neuroendocrine tumors (NETs). Reducing treatment-related costs, such as the number of images, could improve access to 177-LuDOTATE. We evaluated early radiological tumor progression and prognostic factors in patients with NETs treated with 177-LuDOTATE.<h4>Methods</h4>We retrospectively included all patients with NETs who received at least one cycle of 177-LuDOTATE. The primary endpoint was the rate of early radiological progression between cycles 2 and 3 (in 10-16 weeks). Secondary endpoints were progression-free survival (PFS) and overall survival (OS) according to prognostic factors (tumor grade, primary site, functioning syndrome, 177-LuDOTATE treatment line) in Cox proportional hazards models.<h4>Results</h4>The median number of 177-LuDOTATE cycles was 3 (range 1-6) among 59 patients included. Ten (17%) patients had early progression. Among 14 patients who received ≤2 cycles of 177-LuDOTATE, ten (72%) stopped treatment due to disease progression, with five patients having a G2 (ki67: 5-25%) and 4, a G3 (ki67: 25-90%) NET. In the Cox multivariable analysis, higher grade (G2 or G3 vs G1) were significantly associated with inferior PFS and OS. The median PFS of G1, G2 and G3 NET patients were: 34.1, 11.7 and 6.1 months (<i>P</i> = 0.015), respectively.<h4>Conclusions</h4>It is feasible to perform imaging tests after 177-LuDOTATE completion for patients with indolent NETs with the intent to avoid futile assessments. For patients with more aggressive diseases, such as G3 NETs and G2 tumors with high tumor burden, we advise to perform more frequent images during 177-LuDOTATE therapy.","(""Lu-177 DOTATATE"" OR ""Lutetium-177 DOTATATE"" OR ""177Lu-DOTATATE"") AND (CCHEN OR Chile OR ""Latin America"")",2026-05-19
lu177_dotatate,Lu-177 DOTATATE,EuropePMC,MED38390762,10.4274/mirt.galenos.2023.82653,38390762,PMC10899736,Care Pathway at a Cancer Center for the Administration of Radiometabolic Therapy with 177Lu-PSMA in Patients with Metastatic Castration-resistant Prostate Cancer.,"Avila C, Cadavid T, Martínez MC, Varela H, Hernández-Hidalgo N.",,2024,https://europepmc.org/article/MED/38390762,"<h4>Objectives</h4>To present a clinical care model for the administration of 177Lu-labeled prostate-specific membrane antigen (PSMA) in radiometabolic therapy for metastatic castration-resistant prostate cancer (mCRPC) at the National Cancer Institute (NCI) of Bogotá, Colombia.<h4>Methods</h4>A care model was designed for patients with mCRPC based on the VISION study, a prospective, phase III, multicenter, open-label, randomized study in patients with positive <sup>68</sup>Ga-PSMA positron emission tomography/computed tomography who had progressed to taxane and androgen therapy, to receive 177Lu-PSMA-617 combined with the best standard of care vs. the best standard of care alone. The care pathway provided to patients was developed by the Nuclear Medicine Group of the NCI and is the result of adjustments and improvements in the care process and the updating of the literature.<h4>Results</h4>A systematic and efficient care model was formalized and implemented for the administration of 177Lu-PSMA therapy in patients with mCRPC who had previously been treated with at least one androgen receptor pathway inhibitor and one or two taxane regimens, with evidence of disease progression.<h4>Conclusion</h4>An optimized process of care based on the determinants of clinical outcomes was developed for patients who received this type of radiometabolic therapy.","(""Lu-177 DOTATATE"" OR ""Lutetium-177 DOTATATE"" OR ""177Lu-DOTATATE"") AND (CCHEN OR Chile OR ""Latin America"")",2026-05-19
lu177_dotatate,Lu-177 DOTATATE,EuropePMC,PMCPMC3198048,,,PMC3198048,Abstracts of Invited Lectures,,,2011,https://europepmc.org/article/PMC/PMC3198048,,"(""Lu-177 DOTATATE"" OR ""Lutetium-177 DOTATATE"" OR ""177Lu-DOTATATE"") AND (CCHEN OR Chile OR ""Latin America"")",2026-05-19
lu177_dotatate,Lu-177 DOTATATE,EuropePMC,MED32945931,10.1007/s00259-020-04988-4,32945931,PMC7498986,"European Association of Nuclear Medicine October 22 - 30, 2020 Virtual.",,,2020,https://europepmc.org/article/MED/32945931,,"(""Lu-177 DOTATATE"" OR ""Lutetium-177 DOTATATE"" OR ""177Lu-DOTATATE"") AND (CCHEN OR Chile OR ""Latin America"")",2026-05-19
lu177_dotatate,Lu-177 DOTATATE,EuropePMC,MED34585268,10.1007/s00259-021-05356-6,34585268,PMC9388969,"The false myth of ""iodine allergy"" also in nuclear medicine.","Gómez-Perales JL, García-Mendoza A.",,2021,https://europepmc.org/article/MED/34585268,,"(""Lu-177 DOTATATE"" OR ""Lutetium-177 DOTATATE"" OR ""177Lu-DOTATATE"") AND (CCHEN OR Chile OR ""Latin America"")",2026-05-19
lu177_dotatate,Lu-177 DOTATATE,EuropePMC,MED32557274,10.1007/s40268-020-00311-6,32557274,PMC7419407,Cutaneous Adverse Events in Newly Approved FDA Non-cancer Drugs: A Systematic Review.,"Macklis PC, Dulmage B, Evans B, Rosenbach M, Gudjonsson JE, Kaffenberger BH.",,2020,https://europepmc.org/article/MED/32557274,"The prevalence of cutaneous adverse events attributable to newly approved anti-cancer drugs has been well reviewed in the dermatologic literature. In contrast, over 75% of US Food and Drug Administration approvals in the past 5 years have been for non-cancer drugs and indications. This represents multiple other categories of approved medications associated with cutaneous adverse reactions. To investigate the cutaneous adverse events associated with these potentially neglected medications, a systematic review was conducted. Two hundred and forty-one medications approved by the Food and Drug Administration between 2013 and 2018 were reviewed and 180 non-oncologic drugs were identified. The prescribing information for each medication was reviewed for the presence of cutaneous adverse events and a supplemental literature search was performed to better characterize any adverse events outlined within the prescribing information. Most reactions were classified as morbilliform, macular, popular, or maculopapular. Fortunately, only a few severe cutaneous adverse reactions were reported, namely in benznidazole, cannabidiol, and sofosbuvir. This review summarizes available data drawn from clinical trials and case reports involving cutaneous adverse events from the 21 non-oncologic medications associated with cutaneous adverse events.","(""Lu-177 DOTATATE"" OR ""Lutetium-177 DOTATATE"" OR ""177Lu-DOTATATE"") AND (CCHEN OR Chile OR ""Latin America"")",2026-05-19
lu177_dotatate,Lu-177 DOTATATE,EuropePMC,MED41226250,10.3390/molecules30214290,41226250,PMC12610710,"&lt;sup&gt;177&lt;/sup&gt;Lu-Labeled Magnetic Nano-Formulations: Synthesis, Radio- and Physico-Chemical Characterization, Biological Applications, Current Challenges, and Future Perspectives.","Halevas E, Varna D.",,2025,https://europepmc.org/article/MED/41226250,"The advent of nanotechnology has revolutionized the field of medicine, particularly in the development of targeted therapeutic strategies. Among these, radiolabeled nanomaterials have emerged as promising tools for both diagnostic and therapeutic applications, offering precise delivery of radiation to diseased tissues while minimizing damage to healthy ones. Notably, Lutetium-177 (<sup>177</sup>Lu) has gained significant attention due to its favorable emission properties and availability that render it suitable for imaging and therapeutic purposes. When integrated with magnetic nano-formulations, <sup>177</sup>Lu-labeled systems combine the benefits of targeted radiation therapy (TRT) with the unique properties of magnetic nanoparticles (MNPs), such as magnetic resonance imaging (MRI) contrast enhancement and magnetically guided drug delivery to address challenges in diagnosis and treatment of diseases, such as cancer. By examining the latest advancements in their design, particularly surface functionalization and bioconjugation strategies, this study aims to highlight their efficacy in targeted therapy, imaging, and theranostic applications. Furthermore, we discuss the current challenges, such as scalability, biocompatibility, and regulatory hurdles, while proposing future directions to enhance their clinical translation. This comprehensive review underscores the transformative potential of <sup>177</sup>Lu-labeled magnetic nano-formulations in precision medicine and their role in shaping the future of therapeutic interventions.","(""Lu-177 DOTATATE"" OR ""Lutetium-177 DOTATATE"" OR ""177Lu-DOTATATE"") AND (CCHEN OR Chile OR ""Latin America"")",2026-05-19
lu177_dotatate,Lu-177 DOTATATE,EuropePMC,MED30961357,10.1177/1535370219839163,30961357,PMC6552400,Cancer drug development: The missing links.,"Kunnumakkara AB, Bordoloi D, Bordoloi D, Sailo BL, Roy NK, Thakur KK, Banik K, Shakibaei M, Gupta SC, Aggarwal BB.",,2019,https://europepmc.org/article/MED/30961357,"<h4>Impact statement</h4>The success rate for cancer drugs which enter into phase 1 clinical trials is utterly less. Why the vast majority of drugs fail is not understood but suggests that pre-clinical studies are not adequate for human diseases. In 1975, as per the Tufts Center for the Study of Drug Development, pharmaceutical industries expended 100 million dollars for research and development of the average FDA approved drug. By 2005, this figure had more than quadrupled, to $1.3 billion. In order to recover their high and risky investment cost, pharmaceutical companies charge more for their products. However, there exists no correlation between drug development cost and actual sale of the drug. This high drug development cost could be due to the reason that all patients might not respond to the drug. Hence, a given drug has to be tested in large number of patients to show drug benefits and obtain significant results.","(""Lu-177 DOTATATE"" OR ""Lutetium-177 DOTATATE"" OR ""177Lu-DOTATATE"") AND (CCHEN OR Chile OR ""Latin America"")",2026-05-19
lu177_dotatate,Lu-177 DOTATATE,EuropePMC,MED27650181,10.1007/s00259-016-3484-4,27650181,PMC7103113,EANM'16.,,,2016,https://europepmc.org/article/MED/27650181,,"(""Lu-177 DOTATATE"" OR ""Lutetium-177 DOTATATE"" OR ""177Lu-DOTATATE"") AND (CCHEN OR Chile OR ""Latin America"")",2026-05-19
lu177_dotatate,Lu-177 DOTATATE,EuropePMC,MED28894880,10.1007/s00259-017-3822-1,28894880,PMC7103094,EANM'17.,,,2017,https://europepmc.org/article/MED/28894880,,"(""Lu-177 DOTATATE"" OR ""Lutetium-177 DOTATATE"" OR ""177Lu-DOTATATE"") AND (CCHEN OR Chile OR ""Latin America"")",2026-05-19
